[
  {
    "question": "Which of the following statements is a fundamental component of the modern cell theory?",
    "options": [
      "All living organisms are composed of one or more cells.",
      "All cells arise from pre-existing cells through division of the nucleus only.",
      "Cells are the smallest units that can carry out all life processes.",
      "All cells have a nucleus and membrane-bound organelles."
    ],
    "correct": 0,
    "explanation": "The modern cell theory states that all living organisms are composed of one or more cells, the cell is the basic unit of structure and organization in organisms, and all cells arise from pre-existing cells. Option A directly states one of these components, making it correct. Option B is incorrect because cells arise from division of the entire cell, not just the nucleus. Option C is a misinterpretation; while cells are the basic unit, the theory says they are the basic unit of structure and function, not that they must carry out all life processes (some cells are specialized). Option D is false because not all cells have a nucleus (prokaryotes) or membrane-bound organelles.",
    "id": "llm-001",
    "section": "Biological & Biochemical Foundations",
    "subject": "Biology",
    "topic": "The Cell",
    "knowledge_point": "1.1 Cell Theory",
    "type": "discrete",
    "skill": "skill1",
    "subtype": "recall"
  },
  {
    "question": "A scientist discovers a new microscopic organism that lacks a nucleus and other membrane-bound organelles. According to cell theory, which of the following is the most appropriate classification of this organism?",
    "options": [
      "It is a eukaryotic cell.",
      "It is a non-living entity.",
      "It is a type of virus.",
      "It is a prokaryotic cell."
    ],
    "correct": 3,
    "explanation": "The absence of a nucleus and membrane-bound organelles is characteristic of prokaryotic cells, such as bacteria and archaea. According to cell theory, all living organisms are composed of cells, and this organism has cellular structure, so it is not a virus (which are acellular) nor non-living. Eukaryotic cells have a nucleus and membrane-bound organelles, so that is incorrect. Therefore, option B is correct.",
    "id": "llm-002",
    "section": "Biological & Biochemical Foundations",
    "subject": "Biology",
    "topic": "The Cell",
    "knowledge_point": "1.1 Cell Theory",
    "type": "discrete",
    "skill": "skill1",
    "subtype": "recall"
  },
  {
    "question": "Which of the following observations provides the strongest evidence that all cells come from pre-existing cells?",
    "options": [
      "A cell culture that is properly maintained can divide indefinitely.",
      "Cells from different organisms have similar chemical compositions.",
      "A single-celled organism can reproduce to form a new organism.",
      "All cells contain DNA as their genetic material."
    ],
    "correct": 0,
    "explanation": "The statement that all cells arise from pre-existing cells is supported by observations that cells can divide to produce new cells. A cell culture that divides indefinitely demonstrates that new cells are produced from existing ones, providing direct evidence. Option B, similar chemical composition, supports the idea that cells have common ancestry but not specifically that they come from pre-existing cells. Option C shows that a unicellular organism can reproduce, but that is a specific case and not as broad as the general principle. Option D, presence of DNA, also supports common ancestry but not the process of cell origin. Thus, option A is the strongest evidence.",
    "id": "llm-003",
    "section": "Biological & Biochemical Foundations",
    "subject": "Biology",
    "topic": "The Cell",
    "knowledge_point": "1.1 Cell Theory",
    "type": "discrete",
    "skill": "skill1",
    "subtype": "recall"
  },
  {
    "question": "Which of the following structural features is unique to eukaryotic cells and absent in prokaryotic cells?",
    "options": [
      "A cell wall that provides structural support",
      "Ribosomes that synthesize proteins",
      "A plasma membrane that regulates transport",
      "Membrane-bound organelles such as mitochondria"
    ],
    "correct": 3,
    "explanation": "Eukaryotic cells are defined by the presence of membrane-bound organelles, including the nucleus, mitochondria, and endoplasmic reticulum. Prokaryotic cells lack such organelles; their ribosomes, plasma membrane, and cell walls (in many) are present in both domains. Therefore, the correct answer is membrane-bound organelles.",
    "id": "llm-004",
    "section": "Biological & Biochemical Foundations",
    "subject": "Biology",
    "topic": "The Cell",
    "knowledge_point": "1.2 Eukaryotic Cells",
    "type": "discrete",
    "skill": "skill1",
    "subtype": "recall"
  },
  {
    "question": "During the process of phagocytosis, a eukaryotic cell engulfs a bacterial cell. Which organelle is most directly responsible for digesting the engulfed material?",
    "options": [
      "Peroxisome",
      "Golgi apparatus",
      "Ribosome",
      "Lysosome"
    ],
    "correct": 3,
    "explanation": "Lysosomes contain hydrolytic enzymes that digest engulfed material in phagocytosis. Peroxisomes detoxify and break down fatty acids, the Golgi apparatus modifies and packages proteins, and ribosomes synthesize proteins. Thus, the lysosome is the correct organelle.",
    "id": "llm-005",
    "section": "Biological & Biochemical Foundations",
    "subject": "Biology",
    "topic": "The Cell",
    "knowledge_point": "1.2 Eukaryotic Cells",
    "type": "discrete",
    "skill": "skill1",
    "subtype": "recall"
  },
  {
    "question": "In a eukaryotic cell, the synthesis of a secreted protein begins on ribosomes that are free in the cytoplasm. Where are these ribosomes directed to complete the synthesis and translocate the protein into the endoplasmic reticulum?",
    "options": [
      "They are directed to the nucleus",
      "They are directed to the Golgi apparatus",
      "They are directed to the rough endoplasmic reticulum",
      "They are directed to the smooth endoplasmic reticulum"
    ],
    "correct": 2,
    "explanation": "Ribosomes synthesizing proteins destined for secretion are targeted to the rough endoplasmic reticulum (RER) via a signal sequence. The RER is studded with ribosomes and is the site where such proteins are translocated into the lumen for folding and modification. The Golgi apparatus receives proteins from the ER but is not the initial site of synthesis. Smooth ER lacks ribosomes, and the nucleus is not involved in protein synthesis on ribosomes.",
    "id": "llm-006",
    "section": "Biological & Biochemical Foundations",
    "subject": "Biology",
    "topic": "The Cell",
    "knowledge_point": "1.2 Eukaryotic Cells",
    "type": "discrete",
    "skill": "skill1",
    "subtype": "recall"
  },
  {
    "question": "All of the following are functions of the smooth endoplasmic reticulum EXCEPT:",
    "options": [
      "Detoxification of drugs and poisons",
      "Protein synthesis",
      "Calcium ion storage",
      "Lipid synthesis"
    ],
    "correct": 1,
    "explanation": "The smooth endoplasmic reticulum (SER) is involved in lipid synthesis, detoxification, and calcium storage. Protein synthesis is primarily carried out by ribosomes, which are often attached to the rough endoplasmic reticulum. Thus, protein synthesis is not a function of the SER.",
    "id": "llm-007",
    "section": "Biological & Biochemical Foundations",
    "subject": "Biology",
    "topic": "The Cell",
    "knowledge_point": "1.2 Eukaryotic Cells",
    "type": "discrete",
    "skill": "skill1",
    "subtype": "except"
  },
  {
    "question": "Which of the following is NOT a characteristic of mitochondria?",
    "options": [
      "Contains its own DNA and ribosomes",
      "Synthesizes ATP through oxidative phosphorylation",
      "Possesses a double membrane",
      "Site of glycolysis"
    ],
    "correct": 3,
    "explanation": "Mitochondria have their own DNA and ribosomes, produce ATP via oxidative phosphorylation, and have a double membrane. Glycolysis occurs in the cytoplasm, not in the mitochondria. Therefore, 'Site of glycolysis' is the incorrect statement.",
    "id": "llm-008",
    "section": "Biological & Biochemical Foundations",
    "subject": "Biology",
    "topic": "The Cell",
    "knowledge_point": "1.2 Eukaryotic Cells",
    "type": "discrete",
    "skill": "skill1",
    "subtype": "except"
  },
  {
    "question": "A researcher is studying a rare genetic disorder that affects mitochondrial function. She observes that cells from affected patients have significantly reduced ATP production under aerobic conditions, but ATP levels are somewhat restored when the cells are grown in a medium containing high concentrations of pyruvate. Additionally, she notes that the mitochondria in these cells appear swollen and have disorganized cristae. Based on these observations, which of the following is the most likely primary defect in these cells?",
    "options": [
      "A defect in the mitochondrial DNA polymerase",
      "A defect in the outer mitochondrial membrane porin",
      "A defect in the mitochondrial inner membrane transport proteins",
      "A defect in the citric acid cycle enzyme, fumarase"
    ],
    "correct": 2,